data_type,collector,purpose,text
UNSPECIFIED_DATA,UNSPECIFIED_ACTOR,services,"Information may be shared with other companies (""Service Providers"") to assist us in communicating with or providing our services to you."
UNSPECIFIED_DATA,service providers,services,"Information may be shared with other companies (""Service Providers"") to assist us in communicating with or providing our services to you.
These Service Providers may have access to your data in order to provide their required services."
UNSPECIFIED_DATA,we,services,"We will use your information to allow you access to your Alleo account, see your organization's data, manage your account and complete any other actions you may take in our software.
When a Alleo User creates an account or is invited to an existing account, certain information is voluntarily given to us."
cookie / pixel tag,we,"services, legal","But in order to comply with your preferences, we'll have to use just one tiny cookie so that you're not asked to make this choice again.
This website stores cookies on your computer.
We will use both session and persistent cookies to help with things like keeping you logged into your Alleo account."
datum relevant,system,,"Privacy Policy

Application Data : The system stores data relevant to your companys and teams."
event id,we,"services, legal","We retain event IDs and user emails for our Google Calendar add-on, and users can request deletion of this data at any time."
user email,we,"services, legal, security","We retain event IDs and user emails for our Google Calendar add-on, and users can request deletion of this data at any time."
