data_type,collector,purpose,text
UNSPECIFIED_DATA,we,services,"If you are located outside United States and choose to provide information to us, please note that we transfer the data to United States and process it there.
Information may be input into the Service by you or collected by the Service using scripts and other code implemented on such properties.
We use your data to provide and improve the Service."
collect datum,Google,advertising,Google may use the collected data to contextualize and personalize the ads of its own advertising network.
contact information,we,services,"While using our Service, we may ask you to provide us with certain personally identifiable information that can be used to contact or identify you (""Personal Data"")."
credit / debit card number,third party payment processor govern,,"That information is provided directly to our third-party payment processors whose use of your personal information is governed by their Privacy Policy.
We will not store or collect your payment card details."
datum collect,Google,"advertising, analytics","Google uses the data collected to track and monitor the use of our Service.
This data is shared with other Google services."
information access,we,"services, advertising, analytics, security","We may also collect information how the Service is accessed and used (""Usage Data"")."
personal identifier,we,"services, advertising, analytics, security","While using our Service, we may ask you to provide us with certain personally identifiable information that can be used to contact or identify you (""Personal Data"")."
preference cookies,we,"services, advertising, analytics, security","Privacy Policy

Tracking & Cookies Data

Examples of Cookies we use: Preference Cookies: We use Preference Cookies to remember your preferences and various settings."
several different type,we,"services, advertising, analytics, security",We collect several different types of information for various purposes to provide and improve our Service to you.
