data_type,collector,purpose,text
UNSPECIFIED_DATA,Google,,"Google Analytics collects information such as how often users visit this website, what pages they visit when they do so, and what other websites they used prior to coming to this website."
UNSPECIFIED_DATA,we,legal,"Additionally, if you are a European resident, we note that we are processing your information in order to fulfill contracts we might have with you, or otherwise to pursue our legitimate business interests listed above.
We collect information from you when you register on our site, subscribe to a newsletter, download items, fill out a form or enter information on our site or when you download our mobile application from the Google store or Apple store.(the "" App "")
We only provide articles and information."
article,we,legal,We only provide articles and information.
data from website visitor request for information,we,legal,"Cynet Privacy Policy

Customer Service : We use Data from website visitor Requests for Information to:"
device information,we,legal,We collect Device Information using the following technologies:
device information we collect in online advertising,we,legal,We also use the Device Information that we collect in online advertising and retargeting marketing campaigns.
email address,we,legal,We collect your email address in order to:
email address,we,"legal, security, services, advertising, analytics",We collect your email address in order to:
geolocation,we,"legal, security","In addition, when you download our App to your mobile device, we may collect data on the installed apps on your mobile device and your device location at the time of a detected threat in order to view your overall mobile security posture."
information about,we,"legal, security","Additionally, as you browse the Site, we collect information about the individual web pages or products that you view, what websites or search terms referred you to the Site, and information about how you interact with the Site."
information about individual web page you view,we,"legal, security","Additionally, as you browse the Site, we collect information about the individual web pages or products that you view, what websites or search terms referred you to the Site, and information about how you interact with the Site."
information about use of website,we,"legal, security","We use a tool called ""Google Analytics"" to collect information about use of the website."
information we get from google analytics,we,"legal, security, services",We use the information we get from Google Analytics to maintain and improve the website and our products.
ip address,we,"legal, security","For the purposes of Fraud Detection, we collect the following information: Device Information that we collect to help us screen for potential risk and fraud (in particular, your IP address), and more generally to improve and optimize our Website (for example, by generating analytics about how our customers browse and interact with the Site, and to assess the success of our marketing and advertising campaigns)."
ip address,we,"legal, security, services","For the purposes of Fraud Detection, we collect the following information: Device Information that we collect to help us screen for potential risk and fraud (in particular, your IP address), and more generally to improve and optimize our Website (for example, by generating analytics about how our customers browse and interact with the Site, and to assess the success of our marketing and advertising campaigns)."
package dump,we,"legal, security, services","In addition, when you download our App to your mobile device, we may collect data on the installed apps on your mobile device and your device location at the time of a detected threat in order to view your overall mobile security posture."
personal identifier,cynet,,"Cynet collects and processes PII of job applicants (such as contact details and CV) who apply to any of the open positions published on the site and any other (including non-digital) means.
Cynet stores the PII as long as it is necessary to fulfill the purpose for which the data has been collected.
Cynet stores the PII if it is necessary to fulfil the purpose for which the information has been collected.
We use such PII for Cynet's internal recruitment purposes such as, assessing the job applicant, making hiring decisions and contact applicants (e.g., by phone or email).   PII of job applicants is processed by Cynet in accordance with the relevant terms of this Privacy Policy."
personal identifier,we,"legal, security, services, advertising, analytics","Cynet collects and processes PII of job applicants (such as contact details and CV) who apply to any of the open positions published on the site and any other (including non-digital) means.
We may also use or disclose the above mentioned PII when in line with the preferences you have shared with us, provide you with information or advertising relating to our products or services.
We use such PII for Cynet's internal recruitment purposes such as, assessing the job applicant, making hiring decisions and contact applicants (e.g., by phone or email).   PII of job applicants is processed by Cynet in accordance with the relevant terms of this Privacy Policy."
regular malware scanning,we,"legal, security, services, advertising, analytics",We use regular Malware Scanning.
required information mandate,we,"legal, security, services, advertising, analytics","Once we receive and confirm your verifiable consumer request, we will provide you with the required information mandated by CCPA."
