data_type,collector,purpose,text
Facebook,social media,,"Our Website may include Social Media Features, such as the Facebook, Twitter, Instagram, LinkedIn buttons and Widgets, such as the Share this button or interactive mini programs that run on our Website."
Microsoft,social media,,"Our Website may include Social Media Features, such as the Facebook, Twitter, Instagram, LinkedIn buttons and Widgets, such as the Share this button or interactive mini programs that run on our Website."
Twitter,social media,,"Our Website may include Social Media Features, such as the Facebook, Twitter, Instagram, LinkedIn buttons and Widgets, such as the Share this button or interactive mini programs that run on our Website."
UNSPECIFIED_DATA,Personal Information Privacy and Security Association (Vancouver),,"If we disclosed your Personal Information for a business purpose, the categories of Personal Information and categories of recipients of that Personal Information for disclosure;"
UNSPECIFIED_DATA,we,services,"We may retain certain data as necessary to prevent fraud or future abuse, or for legitimate business purposes, such as auditing, account recovery, or if required by applicable federal, state, and provincial laws.
We may use data to enhance the features and functionality of the Services, making them more useful and user-friendly."
advertiser,service provider,services,"DISCO and our service providers (including ad servers, outbound email vendors, affiliate vendors and search engine advertising agencies, and providers of web analytics tools) and business partners may also use ""cookies"" as well as so-called ""pixel tags,"" ""web beacons,"" ""clear GIFs"" and other similar technologies to help us deliver better service and user experience and to facilitate your ongoing access to and use of our Services.
DISCO and our service providers (including ad servers, outbound email vendors, affiliate vendors and search engine advertising agencies, and providers of web analytics tools) may also use ""cookies"" as well as so-called ""pixel tags,"" ""web beacons,"" ""clear GIFs"" and other similar technologies to help us deliver better service and user experience and to facilitate Your ongoing access to and use of our Website and Services."
affiliate vendor,service provider,services,"DISCO and our service providers (including ad servers, outbound email vendors, affiliate vendors and search engine advertising agencies, and providers of web analytics tools) and business partners may also use ""cookies"" as well as so-called ""pixel tags,"" ""web beacons,"" ""clear GIFs"" and other similar technologies to help us deliver better service and user experience and to facilitate your ongoing access to and use of our Services.
DISCO and our service providers (including ad servers, outbound email vendors, affiliate vendors and search engine advertising agencies, and providers of web analytics tools) may also use ""cookies"" as well as so-called ""pixel tags,"" ""web beacons,"" ""clear GIFs"" and other similar technologies to help us deliver better service and user experience and to facilitate Your ongoing access to and use of our Website and Services."
analytic provider,service provider,services,"DISCO and our service providers (including ad servers, outbound email vendors, affiliate vendors and search engine advertising agencies, and providers of web analytics tools) and business partners may also use ""cookies"" as well as so-called ""pixel tags,"" ""web beacons,"" ""clear GIFs"" and other similar technologies to help us deliver better service and user experience and to facilitate your ongoing access to and use of our Services.
DISCO and our service providers (including ad servers, outbound email vendors, affiliate vendors and search engine advertising agencies, and providers of web analytics tools) may also use ""cookies"" as well as so-called ""pixel tags,"" ""web beacons,"" ""clear GIFs"" and other similar technologies to help us deliver better service and user experience and to facilitate Your ongoing access to and use of our Website and Services."
cookie / pixel tag,business partner,services,"DISCO and our service providers (including ad servers, outbound email vendors, affiliate vendors and search engine advertising agencies, and providers of web analytics tools) and business partners may also use ""cookies"" as well as so-called ""pixel tags,"" ""web beacons,"" ""clear GIFs"" and other similar technologies to help us deliver better service and user experience and to facilitate your ongoing access to and use of our Services."
cookie / pixel tag,disco,"analytics, services","DISCO and our service providers (including ad servers, outbound email vendors, affiliate vendors and search engine advertising agencies, and providers of web analytics tools) and business partners may also use ""cookies"" as well as so-called ""pixel tags,"" ""web beacons,"" ""clear GIFs"" and other similar technologies to help us deliver better service and user experience and to facilitate your ongoing access to and use of our Services.
DISCO and our service providers (including ad servers, outbound email vendors, affiliate vendors and search engine advertising agencies, and providers of web analytics tools) may also use ""cookies"" as well as so-called ""pixel tags,"" ""web beacons,"" ""clear GIFs"" and other similar technologies to help us deliver better service and user experience and to facilitate Your ongoing access to and use of our Website and Services.
DISCO, like many other Web Services, uses cookies to understand and save Your preferences for future visits and to compile aggregate data about site traffic and site interaction, so that we can offer better site experiences and tools in the future."
cookie / pixel tag,service provider,services,"DISCO and our service providers (including ad servers, outbound email vendors, affiliate vendors and search engine advertising agencies, and providers of web analytics tools) and business partners may also use ""cookies"" as well as so-called ""pixel tags,"" ""web beacons,"" ""clear GIFs"" and other similar technologies to help us deliver better service and user experience and to facilitate your ongoing access to and use of our Services.
DISCO and our service providers (including ad servers, outbound email vendors, affiliate vendors and search engine advertising agencies, and providers of web analytics tools) may also use ""cookies"" as well as so-called ""pixel tags,"" ""web beacons,"" ""clear GIFs"" and other similar technologies to help us deliver better service and user experience and to facilitate Your ongoing access to and use of our Website and Services."
email service provider,service provider,services,"DISCO and our service providers (including ad servers, outbound email vendors, affiliate vendors and search engine advertising agencies, and providers of web analytics tools) and business partners may also use ""cookies"" as well as so-called ""pixel tags,"" ""web beacons,"" ""clear GIFs"" and other similar technologies to help us deliver better service and user experience and to facilitate your ongoing access to and use of our Services.
DISCO and our service providers (including ad servers, outbound email vendors, affiliate vendors and search engine advertising agencies, and providers of web analytics tools) may also use ""cookies"" as well as so-called ""pixel tags,"" ""web beacons,"" ""clear GIFs"" and other similar technologies to help us deliver better service and user experience and to facilitate Your ongoing access to and use of our Website and Services."
ip address,social media,,"Our Website may include Social Media Features, such as the Facebook, Twitter, Instagram, LinkedIn buttons and Widgets, such as the Share this button or interactive mini programs that run on our Website.
These features may collect Your IP address, which page You are visiting on our Website, and may set a cookie to enable the feature to function properly."
personal information,UNSPECIFIED_ACTOR,,"3.   DISCO may also disclose Personal Information to third parties in connection with a corporate re-organization, merger or amalgamation, or the sale of all or substantially all of our assets, provided that, where appropriate, any party to whom the information is disclosed is bound by agreements or obligations, and required to use or disclose your Personal Information in a manner consistent with the use and disclosure provisions of this Privacy Policy, unless you consent otherwise; or
For example, we may hire other companies to handle the processing of payments, collect debts, to provide data storage, to host Website, to fulfill orders, to assist in direct marketing, to conduct audits, etc.
Those companies will be permitted to obtain only the Personal Information they need to provide the service."
personal information,disco,"analytics, services","1.   DISCO may disclose your Personal Information with your prior consent.
3.   DISCO may also disclose Personal Information to third parties in connection with a corporate re-organization, merger or amalgamation, or the sale of all or substantially all of our assets, provided that, where appropriate, any party to whom the information is disclosed is bound by agreements or obligations, and required to use or disclose your Personal Information in a manner consistent with the use and disclosure provisions of this Privacy Policy, unless you consent otherwise; or
4.   DISCO may share your Personal Information with service providers who perform Services on our behalf.
DISCO may process your Personal Information for the following purposes:
DISCO may transfer your Personal Information to servers located outside of the European Economic Area, the UK, or Canada which provide for a different level of data protection.
DISCO retains your Personal Information for as long as we provide Services to you or for as long as needed for the purpose we collected it and any other permitted linked purpose and in accordance with our data retention policies.
However, DISCO may disclose your Personal Information in the circumstances set out below:
You acknowledge that Personal Information may be retained by DISCO as described in the "" Retention of Personal Information "" below."
personal information,server locate provide for different level of data protection,,"DISCO may transfer your Personal Information to servers located outside of the European Economic Area, the UK, or Canada which provide for a different level of data protection."
personal information,service provider,services,"These service providers are in Canada and the United States and, as a result, Your Personal Information may be stored, processed, or transferred into or out of these countries."
personal information,service provider who perform service on behalf,,4.   DISCO may share your Personal Information with service providers who perform Services on our behalf.
personal information,we,"services, legal, security","If you terminate your account, we will continue to retain your Personal Information for a commercially reasonable period for purposes including, but not limited to, backup, archiving, contract performance, enforcement of rights, defense of proceedings, legal compliance, fraud prevention, dispute resolution, troubleshooting, or auditing.
We also retain and use your Personal Information as required to meet legal obligations, resolve disputes, and enforce our agreements and policies.
We sometimes use your Personal Information because we believe it is in our best interest or the interest of someone else.
We will provide your Personal Information in a structured, commonly used, and machine-readable format.
When we act as a data controller, we may process your Personal Information based on these reasons:
Within the scope of this Privacy Policy, we may also process Personal Information based on the instructions of our customers and anyone running a ""community"" or subdomain on the Services (""Publishers"") .
Your Consent : Sometimes, we will use your Personal Information because you actively indicated it is okay that we do so."
specific information,we,"services, legal, security","When requesting access to your Personal Information, please note that we may request specific information from you to enable us to confirm your identity and right to access, as well as to search for and provide you with the Personal Information that we hold about you."
use,service provider,services,"If You wish to obtain more information on our use of service providers and our policies and practices regarding such service providers, please contact us at privacy@disco.co."
