data_type,collector,purpose,text
UNSPECIFIED_DATA,we,"advertising, analytics, services","From time to time, we may also use your information to contact you for market research purposes.
We collect this information to understand your needs and provide you with better service and in particular for the following reasons:
We may collect the following information:
We may use the information to customize the website according to your interests.
We may use the information to improve our products and services.
We only use this information for statistical analysis purposes and then the data is removed from the system."
cookie / pixel tag,we,"advertising, analytics, services",We use traffic log cookies to identify which pages are being used.
datum about web page traffic,we,"advertising, analytics, services","This helps us analyze data about web page traffic and improve our website in order to tailor it to customer needs.
We only use this information for statistical analysis purposes and then the data is removed from the system."
information about you,we,"advertising, analytics, services","A cookie in no way gives us access to your computer or any information about you, other than the data you choose to share with us."
information you provide,himam,,This privacy policy outlines how Himam uses and protects any information that you provide when you use our website and services.
