data_type,collector,purpose,text
UNSPECIFIED_DATA,we,,"In situations where we obtain your personal data from a source other than you, we process your data on the basis of legitimate interests, until the earlier of (a) the point at which you provide your consent; or (b) the point at which you ask us to stop processing your data on the basis of our legitimate interests.
Please note that we rely on legitimate interests as the basis for processing your data in the limited circumstances set out below: In situations where we obtain your personal data from a source other than you, we process your data on the basis of legitimate interests, until the earlier of (a) the point at which you provide your consent; or (b) the point at which you ask us to stop processing your data on the basis of our legitimate interests;
This privacy policy (""Policy"") describes how we collect, protect and use the personally identifiable information (""Personal Information"") you (""User"", ""you"" or ""your"") provided on the
We also collect information from the URLs from which you linked to our Site.
What Information We Collect
When users come to our Site, we may track, collect and aggregate information indicating, among other things, which pages of our Site were visited, the order in which they were visited, when they were visited, and which hyperlinks were ""clicked."""
asset,we,"advertising, services, analytics, security, legal","In addition, we reserve the right to transfer Personal Information in the event we sell or transfer all or a portion of our business or assets (including in the event of a reorganization, dissolution or liquidation)."
cookie / pixel tag,we,,We also use (or may use) cookies and web beacons when you visit our Site.
credit / debit card number,idecisiongames,,Please note that our service provider - not iDecisionGames - collects and processes your credit card information.
credit / debit card number,service provider,,Please note that our service provider - not iDecisionGames - collects and processes your credit card information.
demographic datum from survey operate,business partner,,"We may share general course data (including quiz or assignment submissions, grades, and forum discussions), information about your activity on our Site, and demographic data from surveys operated by us with our University partners and other business partners so that our University partners and other business partners may use the data for research related to online education."
demographic datum from survey operate,university partner,,"We may share general course data (including quiz or assignment submissions, grades, and forum discussions), information about your activity on our Site, and demographic data from surveys operated by us with our University partners and other business partners so that our University partners and other business partners may use the data for research related to online education."
demographic datum from survey operate,we,,"We may share general course data (including quiz or assignment submissions, grades, and forum discussions), information about your activity on our Site, and demographic data from surveys operated by us with our University partners and other business partners so that our University partners and other business partners may use the data for research related to online education."
email address,we,"advertising, services","If you desire to participate in a course, you will be asked to provide us with certain information necessary to conduct such a course.
This information may include, among other things, your name and email address.
We use this information for the purposes of optimizing and better tailoring our communications to you.
Where we send you emails, we may track the way that you interact with these emails (such as when you open an email or click on a link inside an email)."
email address,we,"advertising, services, analytics, security","If you desire to participate in a course, you will be asked to provide us with certain information necessary to conduct such a course.
This information may include, among other things, your name and email address.
We use this information for the purposes of optimizing and better tailoring our communications to you.
Where we send you emails, we may track the way that you interact with these emails (such as when you open an email or click on a link inside an email)."
information necessary,we,"advertising, services","When you email us with a request, we may ask that you provide us with information necessary to confirm your identity."
information provide,we,"advertising, services","When you send us an email message or otherwise contact us, we may use the information provided by you to respond to your communication and/or as described in this Privacy Policy."
information relate to use of service,we,"advertising, services, analytics","Please note that we rely on legitimate interests as the basis for processing your data in the limited circumstances set out below: We will use information relating to your use of our services for statistical analysis and research purposes, however we delete your name and email address from such information before we do so."
information relate to use of site,we,"advertising, services, analytics, security","We may also use this information to ensure the security of our services and the Site.
We use information relating to your use of the Site to build higher quality, more useful services by performing statistical analyses of the collective characteristics and behavior of our users, and by measuring demographics and interests regarding specific areas of our Site.
What Information We Collect

1. Information relating to your use of our Site."
internet activity,business partner,,"We may share general course data (including quiz or assignment submissions, grades, and forum discussions), information about your activity on our Site, and demographic data from surveys operated by us with our University partners and other business partners so that our University partners and other business partners may use the data for research related to online education."
internet activity,university partner,,"We may share general course data (including quiz or assignment submissions, grades, and forum discussions), information about your activity on our Site, and demographic data from surveys operated by us with our University partners and other business partners so that our University partners and other business partners may use the data for research related to online education."
internet activity,we,"advertising, services, analytics, security","We may share general course data (including quiz or assignment submissions, grades, and forum discussions), information about your activity on our Site, and demographic data from surveys operated by us with our University partners and other business partners so that our University partners and other business partners may use the data for research related to online education."
performance in give online course,individual designate,,"We may also share your Personally Identifiable Information and your performance in a given Online Course with the instructor or instructors who taught the course, with teaching assistants or other individuals designated by the instructor or instructors to assist with the creation, modification or operation of the course, and with the institution or institutions with which they are affiliated."
performance in give online course,institution,,"We may also share your Personally Identifiable Information and your performance in a given Online Course with the instructor or instructors who taught the course, with teaching assistants or other individuals designated by the instructor or instructors to assist with the creation, modification or operation of the course, and with the institution or institutions with which they are affiliated."
performance in give online course,teaching assistant,,"We may also share your Personally Identifiable Information and your performance in a given Online Course with the instructor or instructors who taught the course, with teaching assistants or other individuals designated by the instructor or instructors to assist with the creation, modification or operation of the course, and with the institution or institutions with which they are affiliated."
performance in give online course,we,"advertising, services, analytics, security","We may also share your Personally Identifiable Information and your performance in a given Online Course with the instructor or instructors who taught the course, with teaching assistants or other individuals designated by the instructor or instructors to assist with the creation, modification or operation of the course, and with the institution or institutions with which they are affiliated."
person name,we,"advertising, services, analytics, security","If you desire to participate in a course, you will be asked to provide us with certain information necessary to conduct such a course.
This information may include, among other things, your name and email address."
personal information,UNSPECIFIED_ACTOR,services,"We will only transfer Personal Information to third parties where the third party: (i) has provided satisfactory assurances to us that it will protect the Personal Information in accordance with this Privacy Shield Policy and the Principles; (ii) is located in the EU or a country considered ""adequate"" for privacy by the EU Commission, and therefore is required to comply with the EU data protection laws or substantially equivalent privacy laws; or (iii) has certified to Privacy Shield, and is independently responsible for complying with the Principles."
personal information,partner institution,,"Notwithstanding the foregoing, you agree that we may disclose Personal Information under the following circumstances without offering you an opportunity to opt out of such disclosure: (i) to our partner institutions and other service providers that we have retained to perform requested services on our behalf; (ii) if we are required to do so by law or legal process; (iii) pursuant to valid requests by law enforcement or other government authorities (which we are legally required to respond to); and (iv) when we believe disclosure is necessary to prevent physical harm or financial loss or in connection with an investigation of suspected or actual illegal activity."
personal information,service provider,,"Notwithstanding the foregoing, you agree that we may disclose Personal Information under the following circumstances without offering you an opportunity to opt out of such disclosure: (i) to our partner institutions and other service providers that we have retained to perform requested services on our behalf; (ii) if we are required to do so by law or legal process; (iii) pursuant to valid requests by law enforcement or other government authorities (which we are legally required to respond to); and (iv) when we believe disclosure is necessary to prevent physical harm or financial loss or in connection with an investigation of suspected or actual illegal activity."
personal information,we,"advertising, services, analytics, security","Notwithstanding the foregoing, you agree that we may disclose Personal Information under the following circumstances without offering you an opportunity to opt out of such disclosure: (i) to our partner institutions and other service providers that we have retained to perform requested services on our behalf; (ii) if we are required to do so by law or legal process; (iii) pursuant to valid requests by law enforcement or other government authorities (which we are legally required to respond to); and (iv) when we believe disclosure is necessary to prevent physical harm or financial loss or in connection with an investigation of suspected or actual illegal activity.
This privacy policy (""Policy"") describes how we collect, protect and use the personally identifiable information (""Personal Information"") you (""User"", ""you"" or ""your"") provided on the
We process your personal data as set out in this Privacy Policy on the basis of your consent.
We use your personal information for the purposes set out in the ""How We Use the Information"" section of this Privacy Policy below, including providing our site and services to you, ensuring the security and performance of our site, research relating to academic courses, sharing information with our partners (such as academic institutions) and our suppliers, direct marketing and performing statistical analysis of the use of our site and services.
We will only transfer Personal Information to third parties where the third party: (i) has provided satisfactory assurances to us that it will protect the Personal Information in accordance with this Privacy Shield Policy and the Principles; (ii) is located in the EU or a country considered ""adequate"" for privacy by the EU Commission, and therefore is required to comply with the EU data protection laws or substantially equivalent privacy laws; or (iii) has certified to Privacy Shield, and is independently responsible for complying with the Principles.
We will process Personal Information in a manner that is compatible with and relevant to the purpose for which it was collected or authorized by you."
post submit on forums,we,"advertising, services, analytics, security",We may also use or publish posts submitted on the Forums without using Personally Identification Information.
reasonable access to personal information about you we hold,we,"advertising, services, analytics, security","Upon request, we will provide you with reasonable access to the Personal Information about you that we hold."
student record relate to degree,we,"advertising, services, analytics, security, legal","Please note that we rely on legitimate interests as the basis for processing your data in the limited circumstances set out below: We will retain your student records relating to degrees or credit-bearing courses for our own compliance and verification purposes (including where we are required to do so by our academic institution partners), even after you withdraw your consent to our processing of your data;"
