data_type,collector,purpose,text
file record interaction with introwise,UNSPECIFIED_ACTOR,services,"For operation and maintenance purposes, Introwise and any third-party services may collect files that record interaction with Introwise (System logs) or use other Personal Data (such as the IP Address) for this purpose."
file record interaction with introwise,introwise,services,"For operation and maintenance purposes, Introwise and any third-party services may collect files that record interaction with Introwise (System logs) or use other Personal Data (such as the IP Address) for this purpose."
information concern particular service upon,introwise,services,"In addition to the information contained in this privacy policy, Introwise may provide the User with additional and contextual information concerning particular Services or the collection and processing of Personal Data upon request."
personal datum relate to user,we,,The Owner may process Personal Data relating to Users if one of the following applies:
system log,UNSPECIFIED_ACTOR,services,"For operation and maintenance purposes, Introwise and any third-party services may collect files that record interaction with Introwise (System logs) or use other Personal Data (such as the IP Address) for this purpose."
system log,introwise,services,"For operation and maintenance purposes, Introwise and any third-party services may collect files that record interaction with Introwise (System logs) or use other Personal Data (such as the IP Address) for this purpose."
