data_type,collector,purpose,text
UNSPECIFIED_DATA,we,,"Information we collect includes both information you knowingly and actively provide us when using or participating in any of our services and promotions, and any information automatically sent by your devices in the course of accessing our products and services.
We may collect, hold, use, and disclose information for the following purposes, and personal information will not be further processed in a manner that is incompatible with these purposes:"
full detail of allege breach,we,,"If you believe that we have breached a relevant data protection law and wish to make a complaint, please contact us using the details below and provide us with full details of the alleged breach."
information send in course of,we,,"Information we collect includes both information you knowingly and actively provide us when using or participating in any of our services and promotions, and any information automatically sent by your devices in the course of accessing our products and services."
permission,we,,"If required by law, we will get your permission or give you the opportunity to opt in to or opt out of, as applicable, any new uses of your personal information."
personal information,we,"analytics, legal","How Long We Keep Your Personal Information
However, if necessary, we may retain your personal information for our compliance with a legal, accounting, or reporting obligation or for archiving purposes in the public interest, scientific, or historical research purposes or statistical purposes.
We keep your personal information only for as long as we need to.
We may collect personal information from you when you do any of the following on our website:
We may collect, hold, use, and disclose information for the following purposes, and personal information will not be further processed in a manner that is incompatible with these purposes:"
standard datum provide,we,"analytics, legal","When you visit our website, our servers may automatically log the standard data provided by your web browser."
