data_type,collector,purpose,text
UNSPECIFIED_DATA,UNSPECIFIED_ACTOR,,"We also share your data with external third parties, as detailed below, and some are based outside of the EEA."
UNSPECIFIED_DATA,we,,"We also share your data with external third parties, as detailed below, and some are based outside of the EEA.
When a User tries, subscribes or uses Our Platform and Services and obtains support for the above under an agreement with Us, We receive data from the User and collect and generate data based on Our legitimate interest to provide the requested Services (including improving, securing, and updating the Service), conduct our business operations, and communicate with the User, carry out business development and marketing activities and for administrative and auditing purposes.
Your Personal Data will therefore be kept for the following periods (or, where there is no fixed period, the following factors will be used to determine how long it is kept): If none of the above is, then we will keep your data for a maximum period of two years following your initial communication or signup/Personal Data submission."
aggregate / deidentified / pseudonymized information,UNSPECIFIED_ACTOR,,We may also share aggregated and de-identified information that does not directly identify you with third parties.
aggregate / deidentified / pseudonymized information,we,,We may also share aggregated and de-identified information that does not directly identify you with third parties.
internet activity,we,,"In case of transferring in part or in whole our business and/or assets to another company, we may transfer as well your personal and usage data.
We may sometimes share your personal and usage data with our subsidiaries in light of offering our Services and Platform to You."
internet activity,we,advertising,"In case of transferring in part or in whole our business and/or assets to another company, we may transfer as well your personal and usage data.
We may sometimes share your personal and usage data with our subsidiaries in light of offering our Services and Platform to You."
payment data,payment processor,,Any payment transactions will be encrypted using SSL technology; All payment data is stored by our payment processors and is never stored on our servers.
position,we,"advertising, analytics, services","When you apply for a position by either populating the application form, by email or by hard copy and whether submitted directly by you or by a third-party recruitment agency on your behalf, we will use such data to evaluate you for the open position that you have applied for or any position that we consider you suitable for at the time you submit your resume or at any later date."
