data_type,collector,purpose,text
UNSPECIFIED_DATA,we,legal,"This Privacy Policy explains how we collect, use, disclose, and safeguard your information when you visit our website www.lingoafrica.us, use our services, or interact with us.
We may share or transfer your information in connection with, or during negotiations of, any merger, sale of company assets, financing, or acquisition of all or a portion of our business to another company.
We may share your information in the following situations: For Legal Reasons: We may disclose your information if required to do so by law or in response to valid requests by public authorities (e.g., a court or a government agency)."
information we collect,we,"legal, advertising, analytics, security, services","We use the information we collect for various purposes, including:"
personal information,we,"legal, advertising, analytics, security, services",We may share your information in the following situations: With Your Consent: We may disclose your personal information for any other purpose with your consent.
