data_type,collector,purpose,text
UNSPECIFIED_DATA,we,,"Legal Compliance: We may disclose your information in response to a legal request, court order, or to comply with applicable laws, regulations, or legal processes."
information we collect,we,services,We may use the information we collect for the following purposes:
mazelon technologies private limited,we,services,"This Privacy Policy describes how Mazelon Technologies Private Limited (""we,"" ""us,"" or ""our"") collects, uses, and protects personal information when you use our booking platform (the ""Service"")."
necessary information,we,services,"Integration Partners: If you choose to integrate third-party services like Google Meet, we may share necessary information to facilitate the integration and deliver the requested functionality."
recipient datum,we,services,"Recipient Data: Includes phone numbers and names (if provided).
To facilitate this service, we collect and process the following information:"
usage metric,we,services,"To facilitate this service, we collect and process the following information: Usage Metrics: Delivery logs, read receipts, and engagement data related to messages sent."
