data_type,collector,purpose,text
UNSPECIFIED_DATA,payfunnels,,"Payfunnels also collects information via cookies; blocking cookies may render you unable to access certain Payfunnels products, services, or websites."
datum from stripe,payfunnels,services,Payfunnels uses data from Stripe for the connected user's account.
non,payfunnels,services,"PII and Non-PII may also be collected by Payfunnels during in-person discussions, telephone conversations, and electronic or other written communications."
non-personal information,payfunnels llc refer to as payfunnels,,"Payfunnels, LLC (also referred to herein as ""Payfunnels"") may collect two different types of information, Personally Identifiable Information (""PII"") and Non-Personally Identifiable Information (""Non-PII"")."
personal identifier,UNSPECIFIED_ACTOR,,"Payfunnels may share PII with Payfunnels affiliates and third parties contracting with Payfunnels to provide services to you, e.g., financial institutions."
personal identifier,payfunnels,services,"PII and Non-PII may also be collected by Payfunnels during in-person discussions, telephone conversations, and electronic or other written communications.
Payfunnels may also share PII when required by law, or when you have expressly requested Payfunnels to do so.
Payfunnels may share PII with Payfunnels affiliates and third parties contracting with Payfunnels to provide services to you, e.g., financial institutions."
personal identifier,payfunnels affiliate,,"Payfunnels may share PII with Payfunnels affiliates and third parties contracting with Payfunnels to provide services to you, e.g., financial institutions."
personal identifier,payfunnels llc refer to as payfunnels,,"Payfunnels, LLC (also referred to herein as ""Payfunnels"") may collect two different types of information, Personally Identifiable Information (""PII"") and Non-Personally Identifiable Information (""Non-PII"")."
