data_type,collector,purpose,text
UNSPECIFIED_DATA,UNSPECIFIED_ACTOR,,"However, we may disclose your information in the following circumstances: To trusted third-party service providers who assist us in operating our website and conducting our business."
UNSPECIFIED_DATA,we,,"However, we may disclose your information in the following circumstances:"
cookie / pixel tag,we,"analytics, services",We use cookies to store information about your preferences and to personalize your experience on our website.
cookie / pixel tag,we,"analytics, services, legal",We use cookies to store information about your preferences and to personalize your experience on our website.
email address,we,"analytics, services","If you choose to contact us through the contact form or email, we may collect your name and email address.
We will use this information solely for the purpose of responding to your inquiry."
information browser send,we,"analytics, services",We collect information that your browser sends whenever you visit our website.
person name,we,"analytics, services, legal","If you choose to contact us through the contact form or email, we may collect your name and email address."
personal information,we,"analytics, services, legal","This Privacy Policy describes how we collect, use, and disclose your personal information when you visit our website."
