data_type,collector,purpose,text
UNSPECIFIED_DATA,UNSPECIFIED_ACTOR,,"No other information is shared with any other third-party company for any purpose, under any circumstance."
UNSPECIFIED_DATA,we,,No other information or data is passed to our servers.
browser user agent string,we,security,"When visitors leave comments on the site we collect the data shown in the comments form, and also the visitor's IP address and browser user agent string to help spam detection."
datum show in comment form,we,security,"When visitors leave comments on the site we collect the data shown in the comments form, and also the visitor's IP address and browser user agent string to help spam detection."
email address,Automattic,,An anonymized string created from your email address (also called a hash) may be provided to the Gravatar service to see if you are using it.
ip address,we,security,"We automatically collect your IP address as traffic data so that we can send information back to you when requested.
When visitors leave comments on the site we collect the data shown in the comments form, and also the visitor's IP address and browser user agent string to help spam detection."
license key,plugin,services,"If you purchase a license for a premium edition of the plugin, the plugin will pass your license key to our servers periodically in order to provide you information about the status of your license key (active, inactive, or expired)."
referrer browser send as part of traffic datum,we,security,We collect referrers your browser sends as part of traffic data.
