data_type,collector,purpose,text
UNSPECIFIED_DATA,we,"advertising, legal, services","If you are an employee or representative of a customer or supplier of ours then we may share your information with your employer for the purpose of manging the business relationship between your organisation and us.
In order to achieve these purposes, we share your data with the following people or group of people:
Privacy Policy

HOW LONG WE KEEP YOUR INFORMATION FOR
We may need to process your information to carry out pre-contractual steps relating to a potential contract between us.
We only keep your information for so long as is reasonably necessary."
cookie / pixel tag,we,"advertising, legal, services",This site uses cookies to store information on your computer.
personal information,UNSPECIFIED_ACTOR,legal,"We share your personal information with third parties only where we are required to do so to comply with the law, to protect our rights, to perform our contractual obligations or to efficiently operate our business."
personal information,teach,,"This policy explains how Teach Digital Software L.L.C. (a UAE company with commercial license number 1018442) ( ""Teach"" ) collects and uses your personal information."
personal information,teach digital software l.l.c.,,"This policy explains how Teach Digital Software L.L.C. (a UAE company with commercial license number 1018442) ( ""Teach"" ) collects and uses your personal information."
personal information,uae company with commercial license number,,"This policy explains how Teach Digital Software L.L.C. (a UAE company with commercial license number 1018442) ( ""Teach"" ) collects and uses your personal information."
personal information,we,"advertising, legal, services","Generally speaking, we keep your personal information for the following periods of time:
We share your personal information with third parties only where we are required to do so to comply with the law, to protect our rights, to perform our contractual obligations or to efficiently operate our business."
