data_type,collector,purpose,text
UNSPECIFIED_DATA,trust partner,analytics,"Vivoh may share data with trusted partners to help perform statistical analysis All such third parties are prohibited from using your personal information except to provide these services to Vivoh, and they are required to maintain the confidentiality of your information."
UNSPECIFIED_DATA,vivoh,analytics,"Vivoh may share data with trusted partners to help perform statistical analysis All such third parties are prohibited from using your personal information except to provide these services to Vivoh, and they are required to maintain the confidentiality of your information."
information for,we,,"To wit, we will use your information for, but not limited to, communicating with you in relation to services and/or products you have requested from us."
non-personal information,we,,We also may gather additional personal or non-personal information in the future.
personal information,vivoh,analytics,"Vivoh may disclose your personal information, without notice, if required to do so by law or in the good faith belief that such action is necessary to: (a) conform to the edicts of the law or comply with legal process served by Vivoh or the App; (b) protect and defend the rights or property of Vivoh; and/or (c) act under exigent circumstances to protect the personal safety of users of the App, or the public."
personal information,we,,"However, you may be required to provide certain personal information to us when you elect to use certain features or services available in the App."
