data_type,collector,purpose,text
client datum,waitwell inc.,,"Once a client's term has expired or has been terminated, then WaitWell Inc. will no longer retain the client data nor any personal information.
WaitWell Inc. operates the following websites covered under this Privacy Policy:

WaitWell Inc. will only retain client data for as long as needed."
client datum,we,,This means that we will retain client data for as long as the client has a current and active account with WaitWell Inc.
credit / debit card number,secure payment gateway,,"The Credit Card information is not stored by WaitWell Inc., but instead is only used by the Secure Payment Gateway."
information browser send,we,services,"We may collect information that your browser sends whenever you visit our website (""Log Data"")."
personal information,waitwell inc.,,"Once a client's term has expired or has been terminated, then WaitWell Inc. will no longer retain the client data nor any personal information."
