data_type,collector,purpose,text
cookie / pixel tag,we,services,This website uses cookies to improve your experience.
cookies,we,"services, analytics","Use of Cookies:

In order to improve Services of YuJa, we may use 'Cookies"".
We may use Cookies to provide us information on how you use our products and services to better our Services."
opt choice,we,"services, analytics","We will also provide an EU individuals with opt-out or opt-in choice before we share their data with third parties other than our agents, or before we use it for a purpose other than which it was originally collected or subsequently authorized."
