data_type,collector,purpose,text
UNSPECIFIED_DATA,UNSPECIFIED_ACTOR,,"Where there will be a necessity, we may also engage third-party services (providers) and may share the data with them."
UNSPECIFIED_DATA,we,"legal, security, services","We are committed to protecting and respecting your privacy, so we take your privacy seriously and will use your personal data (the ""data"") to provide the services only after obtaining your consent for the collection and processing of your data as follows
We may also use and disclose the data to enforce the Terms, to protect our rights, privacy, safety, or property, and/or that of our affiliates, you or others, and to respond to requests from courts, law enforcement agencies, regulatory agencies, and other public and government authorities, or in other cases provided for by law.
We process the Client's Data with the following purposes:
We process the Client's data under the following legal bases:
We share the data, in particular, for purposes indicated in section 5 hereof.
We will retain your information:
Where there will be a necessity, we may also engage third-party services (providers) and may share the data with them."
business,closely,,"Still, Closely processes Business and Shared Data as a processor on behalf of our Client."
business datum,client,services,"Closely shares the Business and Shared Data with our Clients, for the purpose of providing our Services and Platform and allowing access to authentic, current, and up to date business contact information."
business datum,closely,services,"Closely shares the Business and Shared Data with our Clients, for the purpose of providing our Services and Platform and allowing access to authentic, current, and up to date business contact information."
information on action take on request,we,"legal, security, services",We will provide information on action taken on your request related to your rights specified above within one month of receipt of the request for the longest.
list of exclude businessperson,we,"legal, security, services","To avoid irrelevant Business and Shared Data, we maintain a list of excluded businesspersons and companies outside of the Business and Shared Data (the ""Opt-out list"")."
relate information,closely,services,"As the Business and Shared Data, Closely processes only the business-related information."
timely update of change,client,"services, analytics",We process the Business and Shared Data with the following purposes: to enable our Clients or their customers to enrich their existing customer relationship management records and receive timely updates of changes;
