data_type,collector,purpose,text
cookie / pixel tag,apptivio,analytics,"Apptivio uses cookies to help Apptivio identify and track visitors, their usage of Apptivio websites, and their website access preferences."
cookie / pixel tag,we,services,This website uses cookies to ensure you get the best experience on our website.
email address,we,services,"For example, we ask visitors who sign up for an account at Apptivio websites to provide an email address."
personal identifier,apptivio,analytics,"Apptivio discloses potentially personally-identifying and personally-identifying information only to those of its employees, contractors and affiliated organizations that
Other than to its employees, contractors and affiliated organizations, as described above, Apptivio discloses potentially personally-identifying and personally-identifying information in response to a subpoena, court order or other governmental request, or when Apptivio believes in good faith that disclosure is reasonably necessary to protect the property or rights of Apptivio, third parties or the public at large."
personal information,advertiser,,"As described in our Privacy Policy, we collect personal information from your interactions with us and our website, including through cookies and similar technologies.
We may also share this personal information with third parties, including advertising partners."
personal information,we,services,"As described in our Privacy Policy, we collect personal information from your interactions with us and our website, including through cookies and similar technologies.
We may also share this personal information with third parties, including advertising partners."
personal information require,apptivio,analytics,"In each case, Apptivio collects such information only insofar as is necessary or appropriate to fulfill the purpose of the visitor's interaction with Apptivio.
Those who engage in transactions with Apptivio - by purchasing access to the premium services, for example - are asked to provide additional information, including as necessary the personal and financial information required to process those transactions."
statistic about behavior of visitor to website,apptivio,analytics,Apptivio may also collect statistics about the behavior of visitors to its websites.
