data_type,collector,purpose,text
cookie / pixel tag,we,"advertising, analytics, services","Our website uses these ""cookies"" to collection information and to improve our Service.
We use cookies to enhance your browsing experience, serve personalized ads or content, and analyze our traffic.
We use cookies to help you navigate efficiently and perform certain functions."
information browser send to we,we,"advertising, analytics, services","We want to inform you that whenever you visit our Service, we collect information that your browser sends to us that is called Log Data."
personal information,UNSPECIFIED_ACTOR,,We want to inform our Service users that these third parties have access to your Personal Information.
personal information,we,"advertising, analytics, services","In the case we discover that a child under 13 has provided us with personal information, we immediately delete this from our servers."
