data_type,collector,purpose,text
UNSPECIFIED_DATA,cogency.io,"analytics, services","General Information : Cogency.io uses information for the following general purposes: products and services provision, billing, identification and authentication, services improvement, contact, research, and anonymous reporting."
bit ssl encryption,cogency.io,"analytics, services, security","Privacy

Editing and Deleting Account Information : Cogency.io uses 256-bit SSL-encryption to protect data transmissions."
demographic information,business partner,,"Cogency.io may share demographic information with business partners, such as ""53% of users who regularly use Cogency.io video service are between 18 and 24"" or the like."
demographic information,cogency.io,"analytics, services, security, advertising","Cogency.io may share demographic information with business partners, such as ""53% of users who regularly use Cogency.io video service are between 18 and 24"" or the like."
information about you,we,,We will transfer information about you if Cogency.io is acquired by or merged with another company.
personal identifier,cogency.io,"analytics, services, security, advertising","Cogency.io may be required to disclose personally identifiable information under special circumstances, such as to comply with subpoenas or when your actions violate the Cogency.io Terms of Service."
usage trend,report,,The reports disclose usage trends without identifying individual users.
