data_type,collector,purpose,text
UNSPECIFIED_DATA,we,legal,"We may disclose your information as required by law, regulation, or legal process.
We retain your information only for as long as necessary to fulfill the purposes outlined in this Privacy Policy and as required by law."
aggregate / deidentified / pseudonymized information,we,"legal, analytics, services",We may use aggregated and anonymized data for analytical purposes to improve the Platform's performance and user experience.
contact information,we,"legal, analytics, services, advertising","3.2 Communication: We may use your contact information to send you updates, announcements, and promotional materials related to our services."
gowajee.ai,we,"legal, analytics, services, advertising","Welcome to Gowajee.ai (""we,"" ""us,"" ""our"")."
information you provide,we,"legal, analytics, services, advertising",3.1 Service Provision: We use the information you provide to deliver and improve our services.
