data_type,collector,purpose,text
cookie / pixel tag,operator,,This cookie is used by the website's operator in context with multi-variate testing.
cookie / pixel tag,we,services,"The cookie is also used to determine how many and which subpages the visitor visits on a website - this information can be used by the website to optimize the domain and its subpages.
The law states that we can store cookies on your device if they are strictly necessary for the operation of this site.
This site uses different types of cookies.
You're lost.

This website uses cookies."
datum on number of time user visit website,Google,,Used by Google Analytics to collect data on the number of times a user has visited the website as well as dates for the first and most recent visit.
datum on visitor behaviour,we,"services, analytics",This allows the website to obtain data on visitor behaviour for statistical purposes.
permission,we,"services, analytics",For all other types of cookies we need your permission.
