data_type,collector,purpose,text
UNSPECIFIED_DATA,we,,"It will notify you of the following: What information we collect;
We will use your information to respond to you, regarding the reason you contacted us."
cookie / pixel tag,we,,"Cookies  We use ""cookies"" on this site."
information you give we via email,we,,We only have access to/collect information that you voluntarily give us via email or other direct contact from you.
personal information,we,,"We will collect and use personal information solely with the objective of fulfilling those purposes specified by us and for other compatible purposes, unless we obtain the consent of the individual concerned or as required by law.
We will collect personal information by lawful and fair means and, where appropriate, with the knowledge or consent of the individual concerned.
We will only retain personal information as long as necessary for the fulfillment of those purposes."
