data_type,collector,purpose,text
UNSPECIFIED_DATA,we,services,"If you respond voluntarily to our surveys or other interactive communications, we collect the responses and use the information to improve the quality and range of Services."
cookie / pixel tag,we,"services, security","We may, for statistical, security or quality purposes, use cookies and other online usage tracking tools to perform and improve our Services."
cookie / pixel tag,we,"services, security, advertising","We may, for statistical, security or quality purposes, use cookies and other online usage tracking tools to perform and improve our Services."
information about you,we,"services, security",We transfer information about you if Nabooki is acquired by or merged with another company.
personal information of individual with whom user interact,we,"services, security, advertising","Any information that is submitted to or collected by Users of Services, Users of our Services are solely responsible for establishing policies for and ensuring compliance with all applicable laws and regulations, as well as all privacy policies, relating to the collection of personal information of individuals with whom our Users interact.
We collect this information under the direction of our Users, and have no direct relationship with individuals whose personal information we process in connection with the use of our Services."
relevant personal information,partner platform,,"If you have opted to use Nabooki Services integrated into one or more partner websites or platforms, such as for example e-commerce marketplaces, daily deal websites, directories, review sites, franchise groups etc (""Partner Platform"") or if your account within Nabooki has been originated from a partner or affiliate that enabled or authorised the registration of your account, or your use of the Services is predominately connected with your use of the Partner Platform, we provide the relevant Personal Information to such Partner Platform."
relevant personal information,we,"services, security, advertising","If you have opted to use Nabooki Services integrated into one or more partner websites or platforms, such as for example e-commerce marketplaces, daily deal websites, directories, review sites, franchise groups etc (""Partner Platform"") or if your account within Nabooki has been originated from a partner or affiliate that enabled or authorised the registration of your account, or your use of the Services is predominately connected with your use of the Partner Platform, we provide the relevant Personal Information to such Partner Platform."
request,we,"services, security, advertising","We will process your request within 30 days of receiving your request, accompanied by a relevant proof of identification."
response,we,"services, security, advertising","If you respond voluntarily to our surveys or other interactive communications, we collect the responses and use the information to improve the quality and range of Services."
