data_type,collector,purpose,text
UNSPECIFIED_DATA,we,,The types and categories of information we collect about you include:
council membership information,foundation,"advertising, services","NAEPC and the Foundation may use council membership information to periodically broadcast newsletters, including national conference announcements."
council membership information,naepc,"advertising, services","NAEPC and the Foundation may use council membership information to periodically broadcast newsletters, including national conference announcements."
personal information,company perform administrative function for we as,,"We may disclose the personal information that we collect to companies that perform administrative functions for us such as sending The AEP ALERT , the NAEPC Journal of Tax & Estate Planning, and annual statements for At-Large dues and AEP and EPLS Annual Dues & Recertification forms."
personal information,we,,"We may disclose the personal information that we collect to companies that perform administrative functions for us such as sending The AEP ALERT , the NAEPC Journal of Tax & Estate Planning, and annual statements for At-Large dues and AEP and EPLS Annual Dues & Recertification forms."
