data_type,collector,purpose,text
UNSPECIFIED_DATA,we,,We acquire information through diverse conduits.
information concern you,we,,We automatically record information concerning you and your computing equipment.
personal information,UNSPECIFIED_ACTOR,advertising,"Should you permit, we may share personal information with third parties for their independent marketing endeavors, contingent upon their adherence to their own privacy frameworks."
personal information,we,advertising,"During business negotiations or deals involving the complete or partial sale or transfer of our business or assets, we may share personal information.
Should you permit, we may share personal information with third parties for their independent marketing endeavors, contingent upon their adherence to their own privacy frameworks."
