data_type,collector,purpose,text
UNSPECIFIED_DATA,pepper cloud,"advertising, analytics, services",Pepper Cloud collects and uses your data for the following purposes:
UNSPECIFIED_DATA,we,,"Pepper Cloud's privacy policy statement is designed to help users (hereinafter ""you"" or ""customer"" or ""individual"") understand how we collect, use and protect your information when you visit our website and when you generally request information on our products and services - whether in person, visiting card, via email, online ads, trade booth, post, telephone, fax or other communication channels
We may release information when Pepper Cloud believes, in good faith, that such release is legitimately necessary to"
information about you,UNSPECIFIED_ACTOR,,"Protection and Disclosure of Information

We may disclose information about you : to companies and departments within Pepper Cloud Group, subject to the terms of this Privacy Policy Statement; and"
information about you,department,,"Protection and Disclosure of Information

We may disclose information about you : to companies and departments within Pepper Cloud Group, subject to the terms of this Privacy Policy Statement; and"
information about you,we,,"Protection and Disclosure of Information

We may disclose information about you"
information on,pepper cloud,"advertising, analytics, services","Upon request, Pepper Cloud can also provide information on how the individual's personal data has been used or disclosed in the past year."
pepper cloud pte ltd.,pepper cloud,"advertising, analytics, services, legal","Pepper Cloud Pte. Ltd. (hereinafter ""Pepper Cloud"" or ""us"" or ""we"") is committed to respecting your privacy and is compliant with all data protection and privacy laws governing Singapore."
