data_type,collector,purpose,text
UNSPECIFIED_DATA,UNSPECIFIED_ACTOR,,We may share information in specific situations and with specific third parties.
UNSPECIFIED_DATA,we,"legal, security, services","For instance, depending on the type of request you submit, we may ask you to provide certain information so that we can match the information you provide with the information we already have on file, or we may contact you through a communication method (e.g. phone or email) that you have previously provided to us.
If you submit the request through an authorised agent, we may need to collect additional information to verify your identity before processing your request.
In Short: We keep your information for as long as necessary to fulfil the purposes outlined in this privacy notice unless otherwise required by law.
In Short: We may use cookies and other tracking technologies to collect and store your information.
In Short: We process your information to provide, improve, and administer our Services, communicate with you, for security and fraud prevention, and to comply with law.
This privacy notice for Samsara (' Company ', ' we ', ' us ', or ' our '), describes how and why we might collect, store, use, and/or share (' process ') your information when you use our services (' Services '), such as when you:
We may also process your information for other purposes with your consent.
We may process your information if you choose to use any of our offerings that allow for communication with another user.
We may process your information to provide you with the requested service.
We may process your information to send you details about our products and services, changes to our terms and policies, and other similar information.
We may share information in specific situations and with specific third parties.
We may share or transfer your information in connection with, or during negotiations of, any merger, sale of company assets, financing, or acquisition of all or a portion of our business to another company.
We may share your information with our affiliates, in which case we will require those affiliates to honour this privacy notice.
We process your information only when we have a valid legal reason to do so."
cookie / pixel tag,we,"legal, security, services","In Short: We may use cookies and other tracking technologies to collect and store your information.
We may use cookies and similar tracking technologies (like web beacons and pixels) to access or store information."
information in specific situation describe in section,UNSPECIFIED_ACTOR,,In Short: We may share information in specific situations described in this section and/or with the following third parties.
information in specific situation describe in section,we,"legal, security, services",In Short: We may share information in specific situations described in this section and/or with the following third parties.
personal information provide in request,we,"legal, security, services, analytics",We will only use personal information provided in your request to verify your identity or authority to make the request.
verification method,we,"legal, security, services, analytics",We may also use other verification methods as the circumstances dictate.
