data_type,collector,purpose,text
UNSPECIFIED_DATA,voiceai,,"VoiceAI will keep your recordings and data for one year, after which they may be deleted, unless an alternative retention policy has been agreed with you."
confidential information,voiceai,legal,"16.2  You acknowledge that VoiceAI may be required to collect, use, store or disclose Confidential Information in order to comply with the Law."
cookie / pixel tag,we,"legal, services","But in order to comply with your preferences, we'll have to use just one tiny cookie so that you're not asked to make this choice again.
This website stores cookies on your computer."
information on site,voiceai,legal,"1.3  VoiceAI provides the Products and the information on the Sites in accordance with these Terms together with any additional terms, conditions, notices or disclaimers placed on the Sites from time to time."
recording,voiceai,legal,"VoiceAI will keep your recordings and data for one year, after which they may be deleted, unless an alternative retention policy has been agreed with you."
voice ai holdings inc,voiceai,legal,"1.1  Voice AI Holdings Inc (USA registration number 7434465) and Voice AI Pty Ltd (Australian Company Number 654124991), collectively VoiceAI, operate a number of Sites for the provision of Products."
voice ai pty ltd,voiceai,legal,"1.1  Voice AI Holdings Inc (USA registration number 7434465) and Voice AI Pty Ltd (Australian Company Number 654124991), collectively VoiceAI, operate a number of Sites for the provision of Products."
